{
    "id": "security-dev-majority-lead",
    "label": "Security Practitioner",
    "segment": "security",
    "organization": {
        "maturity": "*",
        "gtm": "*"
    }, 
    "role": {
        "function": "dev",
        "level": "lead",
        "experience": "*",
        "responsibilities": ["coding", "reviewing", "planning", "reporting"],
        "tools": [],
        "titles": [
            "Software Engineer, Security",
            "Senior Research Engineer",
            "Application Security Engineer",
            "DevSecOps",
            "Network Engineer",
            "Security Engineer",
            "System Admin",
            "Security Sales Engineer",
            "Security Consultant",
            "Director of IT",
            "IT Security Analyst",
            "Sr. Information Security Lead",
            "Cyber Security Lead",
            "Red team / Pentester",
            "Cyber Threat Intelligence Advisor",
            "Information Security Architect",
            "Manager of Information Security",
            "Security Researcher"
        ]
    },
    "adoption": {
        "curve": "majority",
        "modality": ["learn", "understand", "problem"]
    },
    "awareness": {
        "channels": [
                {"format": "blog", "url": "https://thehackernews.com/"},
                {"format": "blog", "url": "https://www.darkreading.com/"},
                {"format": "newsletter", "url": "https://tldrsec.com/", "level":"300"},
                {"format": "newsletter", "url": "https://cloudseclist.com/"},
                {"format": "blog", "url": "https://dev.to/{your product}"}
        ],
        "events": [
            "drf-bsides.org",
            "drf-blackhat.com"
        ]
    },
    "motivations": {
        "likes": [
            "Works in small groups to team up on complex security projects"
        ],
        "dislikes": [
            "Cautious of strangers and those they do not know.",
            "Highly sensitive to sharing personal information that can be exploited. Won't easily sign up for a list."
        ]
    },
    "strategies": {
        "devex": [
            "Build simulations and test environments that provide a safe place to experiment and discover security flaws without risk of negative consequences."
        ]
    }
}