{
    "id": "dev-exec",
    "label": "Ed Exec",
    "narrative": "Deep technical experience over a long career. Has advanced their business understanding, but still rely on other experts for marketing, sales, finance, and other disciplines. Their decisions have major consequences for an entire organization.",
    "segment": "*",
    "organization": {
        "maturity": "*",
        "gtm": "*"
    },
    "role": {
        "function": "dev",
        "level": "lead",
        "experience": "pro",
        "responsibilities": ["strategy", "planning"],
        "titles": [
            "VP, Engineering",
            "Chief Technology Officer",
            "Chief Information Officer", 
            "Chief Information Security Officer"
        ],
        "tools": [ ],
        "technologies": {
            "languages": [ ],
            "environments": [ ],
            "skills": [ ]
        }
    },
    "awareness": {
        "channels": [
            {"format": "web", "url": "https://www.gartner.com/en/newsroom"},
            {"format": "blog", "url": "https://www.forrester.com/blogs/"},
            {"format": "blog", "url": "https://blogs.idc.com/"}
        ],
        "events": ["drf-leaddev.com", "drf-gartner.com"]
    },
    "adoption": {
        "curve": "*",
        "modality": []
    },
    "motivations": {
        "likes": [
        ],
        "dislikes": []
    },
    "strategies": {
        "design": [],
        "product": [],
        "education": [],
        "communications": [],
        "sales": [
            "Ask about their goals and strategy for their technical choices in the next year."
        ],
        "marketing": []
    }
}