{
    "id": "biz-security-early-exec",
    "label": "Security Buyer",
    "segment": "security",
    "organization": {
        "maturity": "startup",
        "gtm": "b2b"
    }, 
    "role": {
        "function": "biz",
        "level": "exec",
        "experience": "pro",
        "responsibilities": ["financials", "strategy"],
        "titles": [
            "Chief Information Security Officer",
            "CISO",
            "VP, Security",
            "Head of Security"
        ]
    },
    "adoption": {
        "curve": "early",
        "modality": ["understand", "info"]
    },
    "awareness": {
        "channels": [
                {"format": "blog", "url": "https://${your-domain}.com/blog"},
                {"format": "product", "url": "https://${your-domain}.com/"},
                {"format": "blog", "url": "https://www.cio.com/", "level": "200"},
                {"format": "newsletter", "url": "https://tldrsec.com/", "level":"200"},
                {"format": "blog", "url": "https://krebsonsecurity.com/"},
                {"format": "newsletter", "url": "https://www.returnonsecurity.com/"}
        ],
        "events": [
            "drf-rsaconference.com"
        ]
    }
}