{
    "id": "mix-lead",
    "parent": ["dev", "biz"],
    "label": "Henry Head",
    "segment": "*",
    "organization": {
        "maturity": "*",
        "gtm": "*"
    },
    "role": {
        "function": "mix",
        "level": "infl",
        "experience": "*",
        "responsibilities": ["coding", "reviewing"],
        "titles": [
            "Head of Developer Relations"
        ],
        "tools": ["drf-ide", "drf-scm", "drf-cicd", "drf-ticketing", "drf-comms", "drf-test", "drf-build"]
    },
    "adoption": {
        "curve": "early"
    },
    "awareness": {
        "channels": [
                {"format": "social", "url": "https://news.ycombinator.com"},
                {"format": "social", "url": "https://slashdot.org"}
        ],
        "events": ["drf-devrelcon.dev"]
    },
    "motivations": {
        "x-likes": [
        ],
        "x-dislikes": [
        ]
    }
}